{
  "schema": "xenon.module-entry",
  "version": 1,
  "id": "org.nimauria.project-gracemeria",
  "name": "Project Gracemeria",
  "type": "game",
  "description": "Xenon game module for Ace Combat 6: Fires of Liberation. The module provides title-specific recompilation metadata, compatibility rules and content definitions while Xenon supplies the shared runtime.",
  "publisher": {
    "name": "Nimauria",
    "github": "nimauria",
    "verified": true
  },
  "license": "MIT",
  "repository": {
    "provider": "github",
    "owner": "nimauria",
    "name": "Project-Gracemeria",
    "defaultBranch": "main"
  },
  "releaseAssets": {
    "windows-x64": "project-gracemeria-windows-x64.xenonmod.zip"
  },
  "tags": [
    "game",
    "ace-combat-6",
    "flight",
    "combat",
    "static-recompilation",
    "project-gracemeria"
  ],
  "launcher": {
    "gameTitle": "Ace Combat 6: Fires of Liberation",
    "moduleName": "Project Gracemeria",
    "tileArt": "assets/org.nimauria.project-gracemeria/game-art.webp",
    "heroArt": "assets/org.nimauria.project-gracemeria/background.webp",
    "description": "Take to the skies of Strangereal in Ace Combat 6: Fires of Liberation through Project Gracemeria and the Xenon native recompilation runtime.",
    "renderer": "Automatic",
    "mode": "Offline",
    "regions": [
      "NTSC-U",
      "PAL"
    ],
    "contentStateLabel": "User-provided Xbox 360 content required",
    "showDlcCatalog": true,
    "compatibility": {
      "status": "development",
      "label": "In development",
      "summary": "Real-title integration is under active development and is not yet considered playable."
    }
  },
  "game": {
    "title": "Ace Combat 6: Fires of Liberation",
    "titleId": "4E4D07D1",
    "developer": "Project Aces",
    "publisher": "Bandai Namco Games",
    "platform": "Xbox 360",
    "releaseYear": 2007,
    "genres": [
      "combat flight simulation",
      "action"
    ],
    "supportedRegions": [
      "NTSC-U",
      "PAL"
    ]
  },
  "content": {
    "identities": [
      {
        "titleId": "4E4D07D1"
      }
    ],
    "identityPolicy": "Title ID is the current strict match. Media ID and XEX version refinements must only be added after each supported regional/revision build is verified."
  },
  "capabilities": [
    "game-identification",
    "dlc-catalog",
    "save-data",
    "offline-launch",
    "module-settings"
  ],
  "dlc": [
    {
      "id": "ac6-ace-of-aces-mission-01",
      "name": "ACE OF ACES MISSION 01",
      "category": "mission",
      "description": "Ace of Aces variant of campaign mission: Invasion of Gracemeria.",
      "optional": true,
      "contentIds": [],
      "identityStatus": "pending-stfs-header-verification",
      "historical": {
        "marketplaceStatus": "released",
        "priceMsp": 350
      },
      "group": "ACE OF ACES"
    },
    {
      "id": "ac6-ace-of-aces-mission-02",
      "name": "ACE OF ACES MISSION 02",
      "category": "mission",
      "description": "Ace of Aces variant of campaign mission: Vitoze Aerial Defense.",
      "optional": true,
      "contentIds": [],
      "identityStatus": "pending-stfs-header-verification",
      "historical": {
        "marketplaceStatus": "released",
        "priceMsp": 300
      },
      "group": "ACE OF ACES"
    },
    {
      "id": "ac6-ace-of-aces-mission-03",
      "name": "ACE OF ACES MISSION 03",
      "category": "mission",
      "description": "Ace of Aces variant of campaign mission: Sipli Field.",
      "optional": true,
      "contentIds": [],
      "identityStatus": "pending-stfs-header-verification",
      "historical": {
        "marketplaceStatus": "released",
        "priceMsp": 350
      },
      "group": "ACE OF ACES"
    },
    {
      "id": "ac6-ace-of-aces-mission-04",
      "name": "ACE OF ACES MISSION 04",
      "category": "mission",
      "description": "Ace of Aces variant of campaign mission: Bartolomeo Fortress.",
      "optional": true,
      "contentIds": [],
      "identityStatus": "pending-stfs-header-verification",
      "historical": {
        "marketplaceStatus": "released",
        "priceMsp": 350
      },
      "group": "ACE OF ACES"
    },
    {
      "id": "ac6-ace-of-aces-mission-09",
      "name": "ACE OF ACES MISSION 09",
      "category": "mission",
      "description": "Ace of Aces variant of campaign mission: Heavy Command Cruiser.",
      "optional": true,
      "contentIds": [],
      "identityStatus": "pending-stfs-header-verification",
      "historical": {
        "marketplaceStatus": "released",
        "priceMsp": 350
      },
      "group": "ACE OF ACES"
    },
    {
      "id": "ac6-team-battle-dl1",
      "name": "TEAM BATTLE DL1",
      "category": "multiplayer",
      "description": "Additional Team Battle multiplayer content.",
      "optional": true,
      "contentIds": [],
      "identityStatus": "pending-stfs-header-verification",
      "historical": {
        "marketplaceStatus": "released",
        "priceMsp": 100,
        "laterFree": true
      },
      "group": "MULTIPLAYER"
    },
    {
      "id": "ac6-battle-royale-dl1",
      "name": "BATTLE ROYALE DL1",
      "category": "multiplayer",
      "description": "Additional Battle Royale multiplayer content.",
      "optional": true,
      "contentIds": [],
      "identityStatus": "pending-stfs-header-verification",
      "historical": {
        "marketplaceStatus": "released",
        "priceMsp": 100,
        "laterFree": true
      },
      "group": "MULTIPLAYER"
    },
    {
      "id": "ac6-co-op-battle-dl1",
      "name": "CO-OP BATTLE DL1",
      "category": "multiplayer",
      "description": "Additional cooperative multiplayer battle content.",
      "optional": true,
      "contentIds": [],
      "identityStatus": "pending-stfs-header-verification",
      "historical": {
        "marketplaceStatus": "released",
        "priceMsp": 300,
        "laterFree": true
      },
      "group": "MULTIPLAYER"
    },
    {
      "id": "ac6-siege-battle-dl1",
      "name": "SIEGE BATTLE DL1",
      "category": "multiplayer",
      "description": "Additional Siege Battle multiplayer content.",
      "optional": true,
      "contentIds": [],
      "identityStatus": "pending-stfs-header-verification",
      "historical": {
        "marketplaceStatus": "released",
        "priceMsp": 300,
        "laterFree": true
      },
      "group": "MULTIPLAYER"
    },
    {
      "id": "ac6-co-op-battle-dl2",
      "name": "CO-OP BATTLE DL2",
      "category": "multiplayer",
      "description": "Additional cooperative multiplayer battle content.",
      "optional": true,
      "contentIds": [],
      "identityStatus": "pending-stfs-header-verification",
      "historical": {
        "marketplaceStatus": "released",
        "priceMsp": 300,
        "laterFree": true
      },
      "group": "MULTIPLAYER"
    },
    {
      "id": "ac6-f-15e-mobius",
      "name": "F-15E -MOBIUS-",
      "category": "aircraft-skin",
      "description": "Aircraft skin/add-on associated with Ace Combat 6 Aircraft PACK00.",
      "optional": true,
      "contentIds": [],
      "identityStatus": "pending-stfs-header-verification",
      "historical": {
        "marketplaceStatus": "preorder"
      },
      "group": "AIRCRAFT PACK00"
    },
    {
      "id": "ac6-f-15e-yellow-squadron",
      "name": "F-15E -YELLOW SQUADRON-",
      "category": "aircraft-skin",
      "description": "Aircraft skin/add-on associated with Ace Combat 6 Aircraft PACK00.",
      "optional": true,
      "contentIds": [],
      "identityStatus": "pending-stfs-header-verification",
      "historical": {
        "marketplaceStatus": "preorder"
      },
      "group": "AIRCRAFT PACK00"
    },
    {
      "id": "ac6-f-14d-halloween",
      "name": "F-14D -HALLOWEEN-",
      "category": "aircraft-skin",
      "description": "Aircraft skin/add-on associated with Ace Combat 6 Aircraft PACK01.",
      "optional": true,
      "contentIds": [],
      "identityStatus": "pending-stfs-header-verification",
      "historical": {
        "marketplaceStatus": "released",
        "priceMsp": 200,
        "laterFree": true
      },
      "group": "AIRCRAFT PACK01"
    },
    {
      "id": "ac6-f-15e-active-stripes",
      "name": "F-15E -ACTIVE STRIPES-",
      "category": "aircraft-skin",
      "description": "Aircraft skin/add-on associated with Ace Combat 6 Aircraft PACK01.",
      "optional": true,
      "contentIds": [],
      "identityStatus": "pending-stfs-header-verification",
      "historical": {
        "marketplaceStatus": "released",
        "priceMsp": 200
      },
      "group": "AIRCRAFT PACK01"
    },
    {
      "id": "ac6-f-16c-type-ace2",
      "name": "F-16C -TYPE ACE2-",
      "category": "aircraft-skin",
      "description": "Aircraft skin/add-on associated with Ace Combat 6 Aircraft PACK01.",
      "optional": true,
      "contentIds": [],
      "identityStatus": "pending-stfs-header-verification",
      "historical": {
        "marketplaceStatus": "released",
        "priceMsp": 200
      },
      "group": "AIRCRAFT PACK01"
    },
    {
      "id": "ac6-f-16c-scarface-emblem",
      "name": "F-16C -SCARFACE EMBLEM-",
      "category": "aircraft-skin",
      "description": "Aircraft skin/add-on associated with Ace Combat 6 Aircraft PACK01.",
      "optional": true,
      "contentIds": [],
      "identityStatus": "pending-stfs-header-verification",
      "historical": {
        "marketplaceStatus": "released",
        "priceMsp": 0,
        "removedBeforeFinalDelisting": true
      },
      "group": "AIRCRAFT PACK01"
    },
    {
      "id": "ac6-su-33-the-idolmaster-miki",
      "name": "Su-33 -THE IDOLMASTER MIKI-",
      "category": "aircraft-skin",
      "description": "Aircraft skin/add-on associated with Ace Combat 6 Aircraft PACK02.",
      "optional": true,
      "contentIds": [],
      "identityStatus": "pending-stfs-header-verification",
      "historical": {
        "marketplaceStatus": "released",